title,slug,make,model,year,body_type,rating,summary,pros,cons,content,faq,meta_title,meta_description,is_published,is_featured
2024 Nissan Navara Review Australia,2024-nissan-navara-review,Nissan,Navara,2024,Dual-Cab Ute,8.8,A capable Australian ute with comfort and towing ability.,"Towing, comfort, reliability","Older technology, engine output",The Nissan Navara remains a practical choice for Australian buyers.,Is Navara good for towing? Yes.,2024 Nissan Navara Review Australia,Nissan Navara ute review Australia.,TRUE,FALSE
2024 Isuzu D-Max Review Australia,2024-isuzu-d-max-review,Isuzu,D-Max,2024,Dual-Cab Ute,9.0,A dependable ute known for durability and capability.,"Reliability, towing, fuel economy","Ride firmness, dated interior",The Isuzu D-Max is one of Australia's trusted work and touring utes.,Is D-Max reliable? Yes.,2024 Isuzu D-Max Review Australia,Isuzu D-Max ute review Australia.,TRUE,FALSE
2024 Mazda BT-50 Review Australia,2024-mazda-bt-50-review,Mazda,BT-50,2024,Dual-Cab Ute,8.9,A refined ute combining capability and comfort.,"Cabin quality, reliability, towing",Limited engine choices,The Mazda BT-50 offers a premium experience with proven mechanicals.,Is BT-50 good for families? Yes.,2024 Mazda BT-50 Review Australia,Mazda BT-50 ute review Australia.,TRUE,FALSE
2024 Volkswagen Amarok Review Australia,2024-volkswagen-amarok-review,Volkswagen,Amarok,2024,Dual-Cab Ute,9.3,A premium ute with strong performance and comfort.,"Interior quality, V6 performance, towing","Price, servicing costs",The Volkswagen Amarok delivers SUV-like comfort with ute capability.,Is Amarok worth buying? It is a premium ute option.,2024 Volkswagen Amarok Review Australia,Volkswagen Amarok review Australia.,TRUE,FALSE
2024 GWM Cannon Review Australia,2024-gwm-cannon-review,GWM,Cannon,2024,Dual-Cab Ute,8.6,A value-packed ute with strong equipment levels.,"Price, features, warranty","Resale value, brand history",The GWM Cannon offers strong value for Australian ute buyers.,Is GWM Cannon good? It provides competitive value.,2024 GWM Cannon Review Australia,GWM Cannon ute review Australia.,TRUE,FALSE
